{
  "id": "secret-safety",
  "provenance": {
    "origin": "agent-stack-local",
    "license": "MIT"
  },
  "declared_tools": ["Bash"],
  "untrusted_content_handling": true,
  "trigger_keywords": ["commit", "push", "paste this", "stage", "git add"],
  "positive_examples": [
    "Can you check this diff before I commit it?",
    "I'm about to push this branch, can you scan for secrets first?",
    "Is it safe to paste this log output into the PR description?"
  ],
  "negative_examples": [
    "What's the weather like today?",
    "Can you refactor this function to use async/await?"
  ],
  "entrypoint": "check.sh",
  "rollback": {
    "method": "Remove \"secret-safety\" from every profiles/*.json skills array, then delete skills/secret-safety/. The skill has no side effects beyond invoking scan-secrets.sh on demand, so no state migration is needed.",
    "date_recorded": "2026-07-18"
  }
}
